{
  "version": "2.0",
  "identity": {
    "agent_id": "agent://example/agent",
    "owner": "Example Corp",
    "keys": [
      {
        "id": "key-1",
        "type": "ed25519",
        "public_key": "ed25519:MI0YrgwrpBd21mfwWi5Kyme8J32JBpRStfLeTjrYZVU=",
        "status": "active"
      }
    ],
    "endpoint": "https://example.com/agent"
  },
  "policy": {
    "capabilities": [
      "scan",
      "query"
    ]
  },
  "signature": "749+ElO3Cua0/xQDL0npagjR9gTwJVA6oGP5rGq3qtXnbv7ziap1mA0xH4yipLV299UEzcjnenQB2dK5KdtrDQ=="
}